Keyword;Seed;Google Domain;
combien 8 chevaux au quinté;combien 8 +chien *;https://www.google.fr;
combien de chien il y a dans pat patroille;combien d +chien *;https://www.google.fr;
combien de chien sont abandonné en france;combien e +chien *;https://www.google.fr;ok
combien de chien a t on le droit d'avoir;combien e +chien *;https://www.google.fr;
combien de chiens refuses confirmation;combien e +chien *;https://www.google.fr;
combien de chien mon dit je t aime;combien e +chien *;https://www.google.fr;
combien de chiens chez soi;combien e +chien *;https://www.google.fr;
combien de chien en france en 2015;combien e +chien *;https://www.google.fr;
combien de chiens tué a la chasse;combien e +chien *;https://www.google.fr;
combien de chiens a la reine d'angleterre;combien e +chien *;https://www.google.fr;
combien de chiens en france;combien e +chien *;https://www.google.fr;
combien de chiens peut on avoir chez soi;combien e +chien *;https://www.google.fr;
combien le chien a t il de dents;combien l +chien *;https://www.google.fr;
combien un chien mange après piroplasmose;combien u +chien *;https://www.google.fr;
combien un chien peut avoir de chiot;combien u +chien *;https://www.google.fr;
combien un chien dort par jour;combien u +chien *;https://www.google.fr;ok
combien un chien doit il boire par jour;combien u +chien *;https://www.google.fr;
